[
  {
    "id": "07815ec1a9d1ac1d528a73e3f63ef9ff74ae8cb7",
    "file": "HansenEconometrics/Chapter12InstrumentalVariables/Kinal.lean",
    "line": 1260,
    "decl": "twoSLSKinalFWLMomentIff_of_coordinateMomentIff",
    "dimension": "redundancy",
    "severity": "minor",
    "rule": "AGENTS.md: keep same-file proof scaffolding private and choose one canonical public API",
    "claim": "This public same-file convenience direction duplicates the public iff theorem's reverse implication.",
    "evidence": "The proof is exactly twoSLSKinalFWLMomentIff_iff_coordinateMomentIff.mpr, and all callers are in Kinal.lean.",
    "suggested_fix": "Make the convenience direction private or inline the public iff theorem at its callers.",
    "mechanical": true,
    "confidence": "high"
  },
  {
    "id": "f349e268e27f8a4aa79764b5ba99e38f7391af9d",
    "file": "HansenEconometrics/Chapter12InstrumentalVariables/Kinal.lean",
    "line": 1283,
    "decl": "twoSLSKinalFWLCoordinateMomentIff_of_scoreCoordinateMomentIff",
    "dimension": "redundancy",
    "severity": "minor",
    "rule": "AGENTS.md: keep same-file proof scaffolding private and choose one canonical public API",
    "claim": "This public same-file convenience direction duplicates the public score-coordinate iff theorem's reverse implication.",
    "evidence": "The proof is exactly twoSLSKinalFWLCoordinateMomentIff_iff_scoreCoordinateMomentIff.mpr, and all callers are in Kinal.lean.",
    "suggested_fix": "Make the convenience direction private or inline the public iff theorem at its callers.",
    "mechanical": true,
    "confidence": "high"
  },
  {
    "id": "7ab9fd20d43292f8f44b96f80772e84db93750b3",
    "file": "HansenEconometrics/Chapter12InstrumentalVariables/Kinal.lean",
    "line": 1532,
    "decl": "twoSLSKinalFittedResidualGramInverseWishartScalarLaws_of_chapter11_map_eq",
    "dimension": "redundancy",
    "severity": "minor",
    "rule": "AGENTS.md: choose one canonical public API for each mathematical object",
    "claim": "The unused theorem duplicates the named-premise residual-Gram theorem after unfolding its definitions.",
    "evidence": "Its Wishart premise and conclusion are definitionally the same as the used named-premise wrapper, and repository search found no caller or inventory citation.",
    "suggested_fix": "Remove the zero-usage duplicate and retain the named-premise theorem as the canonical surface.",
    "mechanical": true,
    "confidence": "high"
  },
  {
    "id": "c8221547c4175b0f245f40ee3a0a626f5c9a3ee3",
    "file": "HansenEconometrics/Chapter12InstrumentalVariables/Kinal.lean",
    "line": 7683,
    "decl": "twoSLSKinal_theorem12_7_of_gaussianMatrixDecomposition_standardizedScoreRestCovariance_canonicalRest_autoSFinite",
    "dimension": "hygiene",
    "severity": "minor",
    "rule": "AGENTS.md PR gate: keep theorem names citeable; use namespaces and local names to avoid very long identifiers",
    "claim": "The construction-path theorem name is not a citeable public Chapter 12 API.",
    "evidence": "The name encodes every implementation detail and has only same-file uses.",
    "suggested_fix": "Rename it to a short content-facing canonical Gaussian-decomposition endpoint.",
    "mechanical": true,
    "confidence": "high"
  },
  {
    "id": "754ca05da50117d4e1de6c3c60e473bee9183937",
    "file": "HansenEconometrics/Chapter12InstrumentalVariables/Kinal.lean",
    "line": 1591,
    "decl": "kinalCoordinateVector_ne_zero",
    "dimension": "proof-quality",
    "severity": "nit",
    "rule": "AGENTS.md proof strategy policy: use stable simplifier support for canonical identities",
    "claim": "The coordinate-vector nonzero proof manually extracts a coordinate although simp closes the goal directly.",
    "evidence": "The target Pi.single j 1 != 0 is solved by `by simp`.",
    "suggested_fix": "Replace the manual proof with `by simp`.",
    "mechanical": false,
    "confidence": "high"
  },
  {
    "id": "02568bc77cce78a2ca88c5bbcf2bb943bbfb56a3",
    "file": "HansenEconometrics/Chapter12InstrumentalVariables/Kinal.lean",
    "line": 1986,
    "decl": "TwoSLSKinalCoordinateInverseWishartStandardGramBridge.of_posDef_cardDim",
    "dimension": "proof-quality",
    "severity": "nit",
    "rule": "AGENTS.md: reuse repo theorems before duplicating proof ideas",
    "claim": "The constructor repeats the coordinate-vector nonzero proof already available in the same file.",
    "evidence": "The local hsingle_ne proves the same proposition as kinalCoordinateVector_ne_zero j.",
    "suggested_fix": "Use kinalCoordinateVector_ne_zero j directly.",
    "mechanical": false,
    "confidence": "high"
  }
]
